ID,iNr
1,"1.约John 3:16-17: 神爱世人，甚至将他的独生子赐给他们，叫一切信他的，不至灭亡，反得永生。For God so loved the world that he gave his one and only Son, that whoever believes in him shall not perish but have eternal life.
因为神差他的儿子降世，不是要定世人的罪，乃是要叫世人因他得救。For God did not send his Son into the world to condemn the world, but to save the world through him."
2,"2.耶Jer 29:11 耶和华说：“我知道我向你们所怀的意念，是赐平安的意念，不是降灾祸的意念，要叫你们末后有指望。For I know the plans I have for you,” declares the LORD, “plans to prosper you and not to harm you, plans to give you hope and a future."
3,"3.罗Rom 8:28 我们晓得万事都互相效力，叫爱神的人得益处，就是按他旨意被召的人。And we know that in all things God works for the good of those who love him, who have been called according to his purpose."
4,"4.腓Phil 4:12-13 我知道怎样处卑贱，也知道怎样处丰富，或饱足，或饥饿，或有余，或缺乏，随事随在，我都得了秘诀。I know what it is to be in need, and I know what it is to have plenty. I have learned the secret of being content in any and every situation, whether well fed or hungry, whether living in plenty or in want.
我靠著那加给我力量的，凡事都能做。I can do everything through him who gives me strength."
5,"5.腓Phil 4:6-7 应当一无挂虑，只要凡事藉著祷告、祈求和感谢，将你们所要的告诉神。Do not be anxious about anything, but in everything, by prayer and petition, with thanksgiving, present your requests to God.<br>神所赐出人意外的平安，必在基督耶稣里，保守你们的心怀意念。And the peace of God, which transcends all understanding, will guard your hearts and your minds in Christ Jesus."
6,"6.箴Prov 3:5-6 你要专心仰赖耶和华，不可倚靠自己的聪明，Trust in the LORD with all your heart and lean not on your own understanding.<br>在你一切所行的事上都要认定他，他必指引你的路。in all your ways acknowledge him, and he will make your paths straight."
7,"7.赛Isa 40:31 但那等候耶和华的，必从新得力。他们必如鹰展翅上腾，他们奔跑却不困倦，行走却不疲乏。but those who hope in the LORD will renew their strength. They will soar on wings like eagles; they will run and not grow weary, they will walk and not be faint."
8,"8.加Gal 2:20 我已经与基督同钉十字架，现在活著的不再是我，乃是基督在我里面活著；并且我如今在肉身活著，是因信神的儿子而活，他是爱我，为我舍己。I have been crucified with Christ and I no longer live, but Christ lives in me. The life I live in the body, I live by faith in the Son of God, who loved me and gave himself for me."
9,"9.弗Eph 2:8-9 你们得救是本乎恩，也因著信。这并不是出于自己，乃是神所赐的； For it is by grace you have been saved, through faith—and this not from yourselves, it is the gift of God<br>也不是出于行为，免得有人自夸。: not by works, so that no one can boast."
10,"10.林后2 Cor 12:9 他对我说：“我的恩典够你用的，因为我的能力是在人的软弱上显得完全。”所以，我更喜欢夸自己的软弱，好叫基督的能力覆庇我。But he said to me, “My grace is sufficient for you, for my power is made perfect in weakness.” Therefore I will boast all the more gladly about my weaknesses, so that Christ’s power may rest on me."
11,11.创Gen 1:1 起初神创造天地。In the beginning God created the heavens and the earth.
12,"12.创Gen 1:27 神就照着自己的形像造人，乃是照着他的形像造男造女。<br>So God created man in his own image, in the image of God he created him; male and female he created them. "
13,"13.创Gen 2:24 因此，人要离开父母与妻子连合，二人成为一体。For this reason a man will leave his father and mother and be united to his wife, and they will become one flesh. (圣经中出现四次)"
14,"14.出Ex 20 （十诫）<br>除了我以外，你不可有别的神 : You shall have no other gods before me. <br>不可为自己雕刻偶像 : You shall not make for yourself an idol in the form of anything.<br>不可妄称耶和华你神的名，因为妄称耶和华名的，耶和华必不以他为无罪 : You shall not misuse the name of the LORD your God, for the LORD will not hold anyone guiltless who misuses his name.<br>当纪念安息日，守为圣日 : Remember the Sabbath day by keeping it holy.<br>当孝敬父母… 不可杀人。不可奸淫。不可偷盗。不可作假见证陷害人。不可贪婪人的房屋… : Honor your father and your mother…You shall not murder. You shall not commit adultery. You should not steal. You shall not give false testimony against your neighbor. You shall not covet your neighbor’s house…"
15,"15.书Josh 1:8 这律法书不可离开你的口，总要昼夜思想，好使你谨守遵行这书上所写的一切话。如此，你的道路就可以亨通，凡事顺利。Do not let this Book of the Law depart from your mouth; meditate on it day and night, so that you may be careful to do everything written in it. Then you will be prosperous and successful."
16,"16.书Josh 1:9 我岂没有吩咐你吗？你当刚强壮胆！不要惧怕，也不要惊惶，因为你无论往哪里去，耶和华你的神必与你同在。”Have I not commanded you? Be strong and courageous. Do not be terrified; do not be discouraged, for the LORD your God will be with you wherever you go.”"
17,"17.书Josh 24:15 至于我和我家，我们必定事奉耶和华。<br>But as for me and my household, we will serve the LORD ."
18,"18.代上1 Ch 4:10 雅比斯求告以色列的神说：“甚愿你赐福与我，扩张我的境界，常与我同在，保佑我不遭患难，不受艰苦。”神就应允他所求的。<br>Jabez cried out to the God of Israel, “Oh, that you would bless me and enlarge my territory! Let your hand be with me, and keep me from harm so that I will be free from pain”. And God granted his request."
19,19.代下2 Ch 16:9 耶和华的眼目遍察全地，要现大能帮助向他心存诚实的人。For the eyes of the LORD range throughout the earth to strengthen those whose hearts are fully committed to him.
20,"20.尼Ne 8:10 你们不要忧愁，因靠耶和华而得的喜乐是你们的力量。Do not grieve, for the joy of the LORD is your strength."
21,21.伯Job 42:5 我从前风闻有你，现在亲眼看见你。My ears had heard of you but now my eyes have seen you.
22,"22.诗Ps 1:2-3 惟喜爱耶和华的律法，昼夜思想，这人便为有福！But his delight is in the law of the LORD, and on his law he meditates day and night.<br>他要象一棵树，栽在溪水旁，按时候结果子，叶子也不枯干。凡他所作的，尽都顺利。He is like a tree planted by streams of water, which yields its fruit in season and whose leaf does not wither. Whatever he does prospers."
23,"23.诗Ps 5:3 耶和华啊，早晨你必听我的声音；早晨我必向你陈明我的心意，并要警醒。<br>In the morning, O LORD , you hear my voice; in the morning I lay my requests before you and wait in expectation."
24,"24.诗Ps 20:7 有人靠车，有人靠马，但我们要提到耶和华我们神的名。<br>Some trust in chariots and some in horses, but we trust in the name of the LORD our God."
25,"25.诗Ps 23 耶和华是我的牧者，我必不至缺乏。：The LORD is my shepherd, I shall not be in want.<br>他使我躺卧在青草地上，领我在可安歇的水边。他使我的灵魂苏醒，为自己的名引导我走义路。：He makes me lie down in green pastures, he leads me beside quiet waters, he restores my soul. He guides me in paths of righteousness for his name's sake.<br>我虽然行过死荫的幽谷，也不怕遭害，因为你与我同在；你的杖，你的竿，都安慰我。：Even though I walk through the valley of the shadow of death, I will fear no evil, for you are with me; your rod and your staff, they comfort me.<br>在我敌人面前，你为我摆设筵席；你用油膏了我的头，使我的福杯满溢。： You prepare a table before me in the presence of my enemies. You anoint my head with oil; my cup overflows.<br>我一生一世必有恩惠慈爱随着我，我且要住在耶和华的殿中，直到永远。： Surely goodness and love will follow me all the days of my life, and I will dwell in the house of the LORD forever."
26,26.诗Ps 37:1 不要为作恶的心怀不平，也不要向那行不义的生出嫉妒。<br>Do not fret because of evil men or be envious of those who do wrong.
27,27.诗Ps 37:4 又要以耶和华为乐，他就将你心里所求的赐给你。Delight yourself in the LORD and he will give you the desires of your heart.
28,28.诗Ps 119:105 你的话是我脚前的灯，是我路上的光。<br>Your word is a lamp to my feet and a light for my path.
29,"29.诗Ps 133:1&3 看哪，弟兄和睦同居，是何等的善，何等的美！How good and pleasant it is when brothers live together in unity!<br>又好比黑门的甘露降在锡安山，因为在那里有耶和华所命定的福，就是永远的生命。It is as if the dew of Hermon were falling on Mount Zion. For there the LORD bestows his blessing, even life forevermore."
30,"30.箴Prov 4:23 你要保守你心，胜过保 守一切。因为一生的果效，是由心发出。<br>Above all else, guard your heart, for it is the wellspring of life."
31,"31.箴Prov 9:10 敬畏耶和华，是智慧的开端。认识至圣者，便是聪明。<br>The fear of the LORD is the beginning of wisdom, and knowledge of the Holy One is understanding."
32,"32.箴Prov 31:29 “才德的女子很多，唯独你超过一切”。<br>Many women do noble things, but you surpass them all."
33,"33.传Ecc 3:1-2凡事都有定期，天下万物都有定时。<br>There is a time for everything, and a season for every activity under heaven.<br>生有时，死有时；栽种有时，拔出所栽种的也有时。<br>A time to be born and a time to die, a time to plant and a time to uproot."
34,"34.赛Isa 30:20-21 主虽然以艰难给你当饼，以困苦给你当水，你的教师却不在隐藏，你眼必看见你的教师。<br>Although the Lord gives you the bread of adversity and the water of affliction, your teachers will be hidden no more; with your own eyes you will see them.<br>你或向左，或向右，你必听见后面有声音说：“这是正路，要行在其间”。<br>Whether you turn to the right or to the left, your ears will hear a voice behind you, saying, “This is the way; walk in it.”"
35,"35.赛Isa 41:10 你不要害怕，因为我与你同在；不要惊惶，因为我是你的神。我必坚固你，我必帮助你, 我必用我公义的右手扶持你。So do not fear, for I am with you; do not be dismayed, for I am your God. I will strengthen you and help you; I will uphold you with my righteous right hand."
36,"36.赛Isa 55:8-9 耶和华说：“我的意念非同你们的意念，我的道路非同你们的道路。“For my thoughts are not your thoughts, neither are your ways my ways,” declares the LORD.<br>天怎样高过地，照样我的道路，高过你们的道路；我的意念，高过你们的意念。""As the heavens are higher than the earth, so are my ways higher than your ways and my thoughts than your thoughts."
37,"37.赛Isa 53:4-6 他诚然担当我们的忧患，背负我们的痛苦；我们却以为他受责罚，被神击打苦待了。 Surely he took up our infirmities and carried our sorrows, yet we considered him stricken by God, smitten by him, and afflicted.<br>哪知他为我们的过犯受害，为我们的罪孽压伤。因他受的刑罚，我们得平安；因他受的鞭伤，我们得医治。 But he was pierced for our transgressions, he was crushed for our iniquities; the punishment that brought us peace was upon him, and by his wounds we are healed.<br>我们都如羊走迷，各人偏行己路。耶和华使我们众人的罪孽都归在他身上。We all, like sheep, have gone astray, each of us has turned to his own way; and the LORD has laid on him the iniquity of us all."
38,"38.弥Mic 6:8 世人哪，耶和华已指示你何为善，他向你所要的是甚么呢？只要你行公义，好怜悯，存谦卑的心，与你的神同行。He has showed you, O man, what is good. And what does the LORD require of you? To act justly and to love mercy and to walk humbly with your God."
39,"39.亚Zec 4:6下 万军之耶和华说：“不是倚靠势力，不是倚靠才能，乃是倚靠我的灵方能成事。” 'Not by might nor by power, but by my Spirit,' says the LORD Almighty."
40,"40.玛Mal 3:10 万军之耶和华说：你们要将当纳的十分之一全然送入仓库，使我家有粮，以此试试我是否为你们敞开天上的窗户，倾福与你们，甚至无处可容. Bring the whole tithe into the storehouse, that there may be food in my house. Test me in this,"" says the LORD Almighty, ""and see if I will not throw open the floodgates of heaven and pour out so much blessing that you will not have room enough for it."
41,"41.太Matt 5:13-14 你们是世上的盐。盐若失了味，怎能叫他再咸呢？以后无用，不过丢在外面， 被人践踏了。<br>""You are the salt of the earth. But if the salt loses its saltiness, how can it be made salty again? It is no longer good for anything, except to be thrown out and trampled by men.<br>你们是世上的光。城造在山上，是不能隐藏的.""You are the light of the world. A city on a hill cannot be hidden."
42,"42.太Matt 5:16 你们的光也当这样照在人前，叫他们看见你们的好行为，便将荣耀归给你们在天上的父。: In the same way, let your light shine before men, that they may see your good deeds and praise your Father in heaven."
43,"43.太Matt 6:9-13  (主祷文) 所以，你们祷告要这样说：“我们在天上的父，愿人都尊你的名为圣。愿你的国降临。愿你的旨意行在地上，如同行在天上。我们日用的饮食，今日赐给我们。免我们的债，如同我们免了人的债。不叫我们遇见试探。救我们脱离凶恶。因为国度、权柄、荣耀，全是你的，直到永远。阿们！”. ""This, then, is how you should pray: "" 'Our Father in heaven, hallowed be your name, your kingdom come, your will be done on earth as it is in heaven. Give us today our daily bread. Forgive us our debts, as we also have forgiven our debtors. And lead us not into temptation, but deliver us from the evil one. '"
44,"44.太Matt 6:33-34 你们要先求他的国和他的义，这些东西都要加给你们了。But seek first his kingdom and his righteousness, and all these things will be given to you as well.<br>所以不要为明天忧虑。因为明天自有明天的忧虑。一天的难处一天当就够了。Therefore do not worry about tomorrow, for tomorrow will worry about itself. Each day has enough trouble of its own."
45,"45.太Matt 7:1-3 你们不要论断人，免得你们被论断。<br>""Do not judge, or you too will be judged. <br>因为你们怎样论断人，也必怎样被论断；你们用什么量器量给人，也必用什么量器量给你们。For in the same way you judge others, you will be judged, and with the measure you use, it will be measured to you.<br>为什么看见你弟兄眼中有刺，却不想自己眼中有梁木呢？""Why do you look at the speck of sawdust in your brother's eye and pay no attention to the plank in your own eye?"
46,"46.太Matt 7:7 你们祈求，就给你们；寻找，就寻见；叩门，就给你们开门。<br>""Ask and it will be given to you; seek and you will find; knock and the door will be opened to you."
47,"47.太Matt 11:28-30 凡劳苦担重担的人，可以到我这里来，我就使你们得安息。“Come to me, all you who are weary and burdened, and I will give you rest.<br>我心里柔和谦卑，你们当负我的轭，学我的样式，这样，你们心里就必得享安息。Take my yoke upon you and learn from me, for I am gentle and humble in heart, and you will find rest for your souls.<br>因为我的轭是容易的，我的担子是轻省的。”: For my yoke is easy and my burden is light.”"
48,"48.太Matt 16:26 人若赚得全世界，赔上自己的生命，有什么益处呢？人还能拿什么换生命呢？What good will it be for a man if he gains the whole world, yet forfeits his soul? Or what can a man give in exchange for his soul?"
49,"49.太Matt 18:20 因为无论在哪里，有两三个人奉我的名聚会，那里有我在他们中间。For where two or three come together in my name, there am I with them. "
50,"50.太Matt 28:18-20 （大使命）<br>耶稣进前来，对他们说：“天上地下所有的权柄都赐给我了。Then Jesus came to them and said, “All authority in heaven and on earth has been given to me.<br>所以，你们要去，使万民作我的门徒，奉父、子、圣灵的名给他们施洗。Therefore go and make disciples of all nations, baptizing them in the name of the Father and of the Son and of the Holy Spirit.<br>耶稣进前来，对他们说：“天上地下所有的权柄都赐给我了。Then Jesus came to them and said, “All authority in heaven and on earth has been given to me.<br>凡我所吩咐你们的，都教训他们遵守，我就常与你们同在，直到世界的末了。” and teaching them to obey everything I have commanded you. And surely I am with you always, to the very end of the age.”"
51,"51.可Mar 12:30-31 你要尽心，尽性，尽意，尽力，爱主你的神。ove the Lord your God with all your heart and with all your soul and with all your mind and with all your strength.'<br>其次，就是说，要爱人如己。再没有比这两条诫命更大的了。he second is this: 'Love your neighbor as yourself.' There is no commandment greater than these."""
52,"52.约John 1:1 太初有道，道与神同在，道就是神。In the beginning was the Word, and the Word was with God, and the Word was God."
53,"53.约John 1:14 道成了肉身，住在我们中间，充充满满地有恩典有真理。我们也见过他的荣光， 正是父独生子的荣光。: The Word became flesh and made his dwelling among us. We have seen his glory, the glory of the One and Only, who came from the Father, full of grace and truth."
54,"54.约John 10:10 盗贼来，无非要偷窃、杀害、毁坏；我来了，是要叫羊得生命，并且得的更丰盛。The thief comes only to steal and kill and destroy; I have come that they may have life, and have it to the full."
55,"55.约John 14:6 耶稣说：“我就是道路、真理、生命；若不藉著我，没有人能到父那里去。Jesus answered, “I am the way and the truth and the life. No one comes to the Father except through me."
56,"56.约John 16:33 我将这些事告诉你们，是要叫你们在我里面有平安。在世上你们有苦难，但你们可以放心，我已经胜了世界。” “I have told you these things, so that in me you may have peace. In this world you will have trouble. But take heart! I have overcome the world.”"
57,"57.徒Acts 1:8 但圣灵降临在你们身上，你们就必得著能力；并要在耶路撒冷、犹太全地和撒马利亚，直到地极，作我的见证。”But you will receive power when the Holy Spirit comes on you; and you will be my witnesses in Jerusalem, and in all Judea and Samaria, and to the ends of the earth.”"
58,"58.徒Acts 4:12 除他以外，别无拯救；因为在天下人间，没有赐下别的名，我们可以靠著得救。” Salvation is found in no one else, for there is no other name under heaven given to men by which we must be saved.”"
59,"59.罗Rom 3:23 因为世人都犯了罪，亏缺了神的荣耀. for all have sinned and fall short of the glory of God,"
60,"60.罗Rom 5:8 惟有基督在我们还作罪人的时候为我们死，神的爱就在此向我们显明了。But God demonstrates his own love for us in this: While we were still sinners, Christ died for us."
61,"61.罗Rom 6:23 因为罪的工价乃是死；惟有神的恩赐，在我们的主基督耶稣里，乃是永生。For the wages of sin is death, but the gift of God is eternal life in Christ Jesus our Lord."
62,"62.罗Rom 7:18 我也知道在我里头，就是我肉体之中，没有良善。因为立志为善由得我，只是行出来由不得我. I know that nothing good lives in me, that is, in my sinful nature. For I have the desire to do what is good, but I cannot carry it out."
63,"63.罗Rom 8:38-39 因为我深信无论是死、是生，是天使、是掌权的，是有能的，是现在的事、是将来的事， For I am convinced that neither death nor life, neither angels nor demons, neither the present nor the future, nor any powers,<br>是高处的、是低处的，是别的受造之物，都不能叫我们与神的爱隔绝；这爱是在我们的主基督耶稣里的。 neither height nor depth, nor anything else in all creation, will be able to separate us from the love of God that is in Christ Jesus our Lord."
64,"64.罗Rom 10:9 你若口里认耶稣为主，心里信神叫他从死里复活，就必得救。 That if you confess with your mouth, “Jesus is Lord,” and believe in your heart that God raised him from the dead, you will be saved."
65,"65.罗Rom 10:17 可见信道是从听道来的，听道是从基督的话来的。Consequently, faith comes from hearing the message, and the message is heard through the word of Christ."
66,"66.罗Rom 12:1-2 所以弟兄们，我以神的慈悲劝你们，将身体献上，当作活祭，是圣洁的，是神所喜悦的；你们如此事奉，乃是理所当然的。Therefore, I urge you, brothers, in view of God’s mercy, to offer your bodies as living sacrifices, holy and pleasing to God—this is your spiritual act of worship.<br>不要效法这个世界，只要心意更新而变化，叫你们察验何为神的善良、纯全、可喜悦的旨意。Do not conform any longer to the pattern of this world, but be transformed by the renewing of your mind. Then you will be able to test and approve what God’s will is—his good, pleasing and perfect will."
67,"67.罗Rom 15:13 但愿使人有盼望的神，因信将诸般的喜乐平安充满你们的心，使你们藉著圣灵的能力大有盼望。May the God of hope fill you with all joy and peace as you trust in him, so that you may overflow with hope by the power of the Holy Spirit."
68,"68.林前1 Cor 6:19 岂不知你们的身子就是圣灵的殿吗？这圣灵是从神而来，住在你们里头的；并且你们不是自己的人.Do you not know that your body is a temple of the Holy Spirit, who is in you, whom you have received from God? You are not your own;"
69,"69.林前1 Cor 10:13 你们所遇见的试探，无非是人所能受的。神是信实的，必不叫你们受试探过于所能受的。在受试探的时候，总要给你们开一条出路，叫你们能忍受得住。No temptation has seized you except what is common to man. And God is faithful; he will not let you be tempted beyond what you can bear. But when you are tempted, he will also provide a way out so that you can stand up under it."
70,"70.林前1 Cor 10:23 凡事都可行，但不都有益处。凡事都可行，但不都造就人。""Everything is permissible""--but not everything is beneficial. ""Everything is permissible""--but not everything is constructive. "
71,"71.林前1 Cor 13:4-8 爱是恒久忍耐，又有恩慈；爱是不嫉妒，爱是不自夸，不张狂。不做害羞的事，不求自己的益处，不轻易发怒，不计算人的恶。不喜欢不义，只喜欢真理。凡事包容，凡事相信，凡事盼望，凡事忍耐。爱是永不止息。Love is patient, love is kind. It does not envy, it does not boast, it is not proud. It is not rude, it is not self-seeking, it is not easily angered, it keeps no record of wrongs. Love does not delight in evil but rejoices with the truth. It always protects, always trusts, always hopes, always perseveres. Love never fails."
72,"72.林后2 Cor 1:4 我们在一切患难中，他就安慰我们，叫我们能用神所赐的安慰去安慰那遭各样患难的人。 Who comforts us in all our troubles, so that we can comfort those in any trouble with the comfort we ourselves have received from God. "
73,"73.林后2 Cor 5:17 若有人在基督里，他就是新造的人，旧事已过，都变成新的了。 Therefore, if anyone is in Christ, he is a new creation; the old has gone, the new has come!"
74,74.林后2 Cor 6:14 你们和不信的原不相配，不要同负一轭。义和不义有什么相交呢？光明和黑暗有什么相通呢？ Do not be yoked together with unbelievers. For what do righteousness and wickedness have in common? Or what fellowship can light have with darkness? 
75,"75.加Gal 5:22-23 圣灵所结的果子，就是仁爱、喜乐、和平、忍耐、恩慈、良善、信实、But the fruit of the Spirit is love, joy, peace, patience, kindness, goodness, faithfulness,<br>温柔、节制。这样的事，没有律法禁止。gentleness and self-control. Against such things there is no law."
76,"76.弗Eph 3:20 神能照著运行在我们心里的大力，充充足足地成就一切，超过我们所求所想的。 Now to him who is able to do immeasurably more than all we ask or imagine, according to his power that is at work within us,"
